{
  "report_version": "2",
  "feature_id": "FEAT-SKILL-FIRST-001",
  "work_package_id": "WP-SKILL-FIRST-SMC-COPILOT",
  "source_revision": "SKILL-FIRST-PRD@4.0.1",
  "repository_commit": "abcdef0123456789abcdef0123456789abcdef03",
  "status": "PASS",
  "generated_at": "2026-09-01T12:00:00+00:00",
  "results": [
    {
      "verification_id": "V-01",
      "status": "PASS",
      "exit_code": 0,
      "duration_ms": 100,
      "stdout_sha256": null,
      "stderr_sha256": null
    }
  ]
}
